{
  "execution_readiness_id": "execution_readiness_shinkai_01_v1",
  "phase": "PHASE-SOURCE-VIDEO-037-MOVIE_ANALYSIS_EXECUTION_READINESS_DESIGN_V1",
  "generation_blueprint_id": "generation_blueprint_shinkai_01_v1",
  "source_video_id": "SHINKAI_01",
  "scene_readiness": [
    {
      "element_id": "execution_readiness_shinkai_01_v1_scene_001",
      "source_blueprint_element_ids": [
        "generation_blueprint_shinkai_01_v1_scene_001",
        "generation_blueprint_shinkai_01_v1_scene_002",
        "generation_blueprint_shinkai_01_v1_scene_003",
        "generation_blueprint_shinkai_01_v1_scene_004",
        "generation_blueprint_shinkai_01_v1_scene_005",
        "generation_blueprint_shinkai_01_v1_scene_006",
        "generation_blueprint_shinkai_01_v1_scene_007"
      ],
      "estimated_readiness_value": "estimated_readiness_scene_layout",
      "execution_readiness_only": true
    },
    {
      "element_id": "execution_readiness_shinkai_01_v1_scene_002",
      "source_blueprint_element_ids": [
        "generation_blueprint_shinkai_01_v1_scene_001"
      ],
      "estimated_readiness_value": "estimated_readiness_scene_scene_layout",
      "execution_readiness_only": true
    },
    {
      "element_id": "execution_readiness_shinkai_01_v1_scene_003",
      "source_blueprint_element_ids": [
        "generation_blueprint_shinkai_01_v1_scene_002"
      ],
      "estimated_readiness_value": "estimated_readiness_scene_scene_scene_layout",
      "execution_readiness_only": true
    },
    {
      "element_id": "execution_readiness_shinkai_01_v1_scene_004",
      "source_blueprint_element_ids": [
        "generation_blueprint_shinkai_01_v1_scene_003"
      ],
      "estimated_readiness_value": "estimated_readiness_scene_scene_scene_scene_layout",
      "execution_readiness_only": true
    },
    {
      "element_id": "execution_readiness_shinkai_01_v1_scene_005",
      "source_blueprint_element_ids": [
        "generation_blueprint_shinkai_01_v1_scene_004"
      ],
      "estimated_readiness_value": "estimated_readiness_scene_scene_scene_scene_open",
      "execution_readiness_only": true
    },
    {
      "element_id": "execution_readiness_shinkai_01_v1_scene_006",
      "source_blueprint_element_ids": [
        "generation_blueprint_shinkai_01_v1_scene_005"
      ],
      "estimated_readiness_value": "estimated_readiness_scene_scene_scene_scene_develop",
      "execution_readiness_only": true
    },
    {
      "element_id": "execution_readiness_shinkai_01_v1_scene_007",
      "source_blueprint_element_ids": [
        "generation_blueprint_shinkai_01_v1_scene_006"
      ],
      "estimated_readiness_value": "estimated_readiness_scene_scene_scene_scene_peak",
      "execution_readiness_only": true
    },
    {
      "element_id": "execution_readiness_shinkai_01_v1_scene_008",
      "source_blueprint_element_ids": [
        "generation_blueprint_shinkai_01_v1_scene_007"
      ],
      "estimated_readiness_value": "estimated_readiness_scene_scene_scene_scene_resolve",
      "execution_readiness_only": true
    }
  ],
  "character_readiness": [
    {
      "element_id": "execution_readiness_shinkai_01_v1_character_001",
      "source_blueprint_element_ids": [
        "generation_blueprint_shinkai_01_v1_character_001",
        "generation_blueprint_shinkai_01_v1_character_002",
        "generation_blueprint_shinkai_01_v1_character_003",
        "generation_blueprint_shinkai_01_v1_character_004",
        "generation_blueprint_shinkai_01_v1_character_005"
      ],
      "estimated_readiness_value": "estimated_readiness_character_layout",
      "execution_readiness_only": true
    },
    {
      "element_id": "execution_readiness_shinkai_01_v1_character_002",
      "source_blueprint_element_ids": [
        "generation_blueprint_shinkai_01_v1_character_001"
      ],
      "estimated_readiness_value": "estimated_readiness_character_character_layout",
      "execution_readiness_only": true
    },
    {
      "element_id": "execution_readiness_shinkai_01_v1_character_003",
      "source_blueprint_element_ids": [
        "generation_blueprint_shinkai_01_v1_character_002"
      ],
      "estimated_readiness_value": "estimated_readiness_character_character_character_layout",
      "execution_readiness_only": true
    },
    {
      "element_id": "execution_readiness_shinkai_01_v1_character_004",
      "source_blueprint_element_ids": [
        "generation_blueprint_shinkai_01_v1_character_003"
      ],
      "estimated_readiness_value": "estimated_readiness_character_character_character_character_layout",
      "execution_readiness_only": true
    },
    {
      "element_id": "execution_readiness_shinkai_01_v1_character_005",
      "source_blueprint_element_ids": [
        "generation_blueprint_shinkai_01_v1_character_004"
      ],
      "estimated_readiness_value": "estimated_readiness_character_character_character_character_continuity_character_arc",
      "execution_readiness_only": true
    },
    {
      "element_id": "execution_readiness_shinkai_01_v1_character_006",
      "source_blueprint_element_ids": [
        "generation_blueprint_shinkai_01_v1_character_005"
      ],
      "estimated_readiness_value": "estimated_readiness_character_character_character_character_continuity_character_hold",
      "execution_readiness_only": true
    }
  ],
  "camera_readiness": [
    {
      "element_id": "execution_readiness_shinkai_01_v1_camera_001",
      "source_blueprint_element_ids": [
        "generation_blueprint_shinkai_01_v1_camera_001",
        "generation_blueprint_shinkai_01_v1_camera_002",
        "generation_blueprint_shinkai_01_v1_camera_003",
        "generation_blueprint_shinkai_01_v1_camera_004",
        "generation_blueprint_shinkai_01_v1_camera_005",
        "generation_blueprint_shinkai_01_v1_camera_006",
        "generation_blueprint_shinkai_01_v1_camera_007"
      ],
      "estimated_readiness_value": "estimated_readiness_camera_layout",
      "execution_readiness_only": true
    },
    {
      "element_id": "execution_readiness_shinkai_01_v1_camera_002",
      "source_blueprint_element_ids": [
        "generation_blueprint_shinkai_01_v1_camera_001"
      ],
      "estimated_readiness_value": "estimated_readiness_camera_camera_layout",
      "execution_readiness_only": true
    },
    {
      "element_id": "execution_readiness_shinkai_01_v1_camera_003",
      "source_blueprint_element_ids": [
        "generation_blueprint_shinkai_01_v1_camera_002"
      ],
      "estimated_readiness_value": "estimated_readiness_camera_camera_camera_layout",
      "execution_readiness_only": true
    },
    {
      "element_id": "execution_readiness_shinkai_01_v1_camera_004",
      "source_blueprint_element_ids": [
        "generation_blueprint_shinkai_01_v1_camera_003"
      ],
      "estimated_readiness_value": "estimated_readiness_camera_camera_camera_camera_layout",
      "execution_readiness_only": true
    },
    {
      "element_id": "execution_readiness_shinkai_01_v1_camera_005",
      "source_blueprint_element_ids": [
        "generation_blueprint_shinkai_01_v1_camera_004"
      ],
      "estimated_readiness_value": "estimated_readiness_camera_camera_camera_camera_camera_layout",
      "execution_readiness_only": true
    },
    {
      "element_id": "execution_readiness_shinkai_01_v1_camera_006",
      "source_blueprint_element_ids": [
        "generation_blueprint_shinkai_01_v1_camera_005"
      ],
      "estimated_readiness_value": "estimated_readiness_camera_camera_camera_camera_camera_camera_hold",
      "execution_readiness_only": true
    },
    {
      "element_id": "execution_readiness_shinkai_01_v1_camera_007",
      "source_blueprint_element_ids": [
        "generation_blueprint_shinkai_01_v1_camera_006"
      ],
      "estimated_readiness_value": "estimated_readiness_camera_camera_camera_camera_camera_camera_shift",
      "execution_readiness_only": true
    },
    {
      "element_id": "execution_readiness_shinkai_01_v1_camera_008",
      "source_blueprint_element_ids": [
        "generation_blueprint_shinkai_01_v1_camera_007"
      ],
      "estimated_readiness_value": "estimated_readiness_camera_camera_camera_camera_camera_camera_bridge",
      "execution_readiness_only": true
    }
  ],
  "emotion_readiness": [
    {
      "element_id": "execution_readiness_shinkai_01_v1_emotion_001",
      "source_blueprint_element_ids": [
        "generation_blueprint_shinkai_01_v1_emotion_001",
        "generation_blueprint_shinkai_01_v1_emotion_002",
        "generation_blueprint_shinkai_01_v1_emotion_003",
        "generation_blueprint_shinkai_01_v1_emotion_004",
        "generation_blueprint_shinkai_01_v1_emotion_005",
        "generation_blueprint_shinkai_01_v1_emotion_006"
      ],
      "estimated_readiness_value": "estimated_readiness_emotion_layout",
      "execution_readiness_only": true
    },
    {
      "element_id": "execution_readiness_shinkai_01_v1_emotion_002",
      "source_blueprint_element_ids": [
        "generation_blueprint_shinkai_01_v1_emotion_001"
      ],
      "estimated_readiness_value": "estimated_readiness_emotion_emotion_layout",
      "execution_readiness_only": true
    },
    {
      "element_id": "execution_readiness_shinkai_01_v1_emotion_003",
      "source_blueprint_element_ids": [
        "generation_blueprint_shinkai_01_v1_emotion_002"
      ],
      "estimated_readiness_value": "estimated_readiness_emotion_emotion_emotion_layout",
      "execution_readiness_only": true
    },
    {
      "element_id": "execution_readiness_shinkai_01_v1_emotion_004",
      "source_blueprint_element_ids": [
        "generation_blueprint_shinkai_01_v1_emotion_003"
      ],
      "estimated_readiness_value": "estimated_readiness_emotion_emotion_emotion_emotion_layout",
      "execution_readiness_only": true
    },
    {
      "element_id": "execution_readiness_shinkai_01_v1_emotion_005",
      "source_blueprint_element_ids": [
        "generation_blueprint_shinkai_01_v1_emotion_004"
      ],